{
  "specversion": "1.0",
  "id": "11111111-1111-4111-8111-111111111111",
  "source": "/contexts/ordering",
  "type": "com.ecommerce.ordering.order-placed.v1",
  "time": "2026-01-01T00:00:00Z",
  "datacontenttype": "application/json",
  "correlationid": "corr-1001",
  "causationid": "cause-1001",
  "data": {
    "order_id": "22222222-2222-4222-8222-222222222222",
    "customer_id": "cust-001",
    "quote_id": "quote-1",
    "quote_version": "v1",
    "total_amount_minor": 10000,
    "currency": "CNY",
    "items": [
      {
        "sku_id": "sku-apple-1",
        "quantity": 2,
        "unit_price_minor": 5000
      }
    ]
  }
}
