{
  "specversion": "1.0",
  "id": "11111111-1111-4111-8111-111111111111",
  "source": "/contexts/inventory",
  "type": "com.ecommerce.inventory.stock-shortage.v1",
  "time": "2026-01-01T00:00:00Z",
  "datacontenttype": "application/json",
  "correlationid": "corr-1001",
  "causationid": "cause-1001",
  "data": {
    "order_id": "22222222-2222-4222-8222-222222222222",
    "unavailable_items": [
      {
        "sku_id": "sku-apple-1",
        "requested_quantity": 5,
        "available_quantity": 1
      }
    ]
  }
}
