{
  "specversion": "1.0",
  "id": "11111111-1111-4111-8111-111111111111",
  "source": "/contexts/payment",
  "type": "com.ecommerce.payment.payment-refunded.v1",
  "time": "2026-01-01T00:00:00Z",
  "datacontenttype": "application/json",
  "correlationid": "corr-1001",
  "causationid": "cause-1001",
  "data": {
    "payment_id": "33333333-3333-4333-8333-333333333333",
    "refund_id": "55555555-5555-4555-8555-555555555555",
    "capture_id": "66666666-6666-4666-8666-666666666666",
    "order_id": "22222222-2222-4222-8222-222222222222",
    "amount_minor": 10000,
    "currency": "CNY"
  }
}
